{
  "schema_version": "0.1",
  "updated_at": "2026-08-08",
  "status_scale": {
    "satisfied": "Completion evidence exists and is machine-checkable where practical.",
    "partial": "Useful repo-side work exists, but the final requirement is not proven.",
    "pending_external_evidence": "The repo has the harness or process, but real external evidence is still required.",
    "deferred_by_user": "The requirement is intentionally held until explicit user approval.",
    "not_started": "No meaningful implementation or validation evidence exists yet."
  },
  "gates": [
    {
      "id": "milestone8_live_smoke_openai_responses",
      "area": "milestone8",
      "requirement": "Run an API-key-gated OpenAI Responses live smoke and keep only sanitized evidence.",
      "status": "satisfied",
      "required_for": ["milestone8", "public_beta", "v1"],
      "required_evidence": [
        "Sanitized live smoke JSON with scenario openai_responses and status passed.",
        "Product-truth register entries for any non-passing OpenAI Responses findings."
      ],
      "current_evidence": [
        {
          "kind": "report",
          "path": "docs/internal/reports/2026-05-27-live-framework-and-billing-review.md",
          "proves": "A sanitized OpenAI Responses live smoke passed with raw responses omitted."
        },
        {
          "kind": "fixture",
          "path": "fixtures/source-files/alpha-smoke-live-openai-responses-2026-05-27.json",
          "proves": "The reviewed smoke evidence includes scenario openai_responses with status passed."
        },
        {
          "kind": "fixture",
          "path": "fixtures/source-files/alpha-smoke-live-all-2026-05-27.json",
          "proves": "The complete reviewed live smoke bundle includes OpenAI Responses with status passed."
        },
        {
          "kind": "report",
          "path": "docs/internal/reports/2026-05-27-operator-action-completion-audit.md",
          "proves": "The remaining OpenAI Responses live-smoke gap requires operator-provided OpenAI credentials."
        },
        {
          "kind": "report",
          "path": "docs/internal/reports/2026-05-26-alpha-smoke-live-no-credentials.md",
          "proves": "The live harness skips safely when OPENAI_API_KEY is absent; it does not prove live provider behavior."
        },
        {
          "kind": "script",
          "path": "scripts/run_alpha_smoke.py",
          "proves": "The optional live smoke entrypoint exists and validates sanitized report shape before writing output."
        },
        {
          "kind": "script",
          "path": "scripts/run_alpha_smoke_preflight.py",
          "proves": "Credential and optional dependency readiness can be checked with sanitized next-action guidance and without emitting secret values."
        },
        {
          "kind": "schema",
          "path": "schemas/alpha-smoke-report.schema.json",
          "proves": "Alpha smoke and preflight evidence share a documented sanitized report contract with mode-specific aggregate smoke, framework, preflight, and sample-price acknowledgement rules."
        },
        {
          "kind": "script",
          "path": "scripts/check_alpha_smoke_contract.py",
          "proves": "Alpha smoke evidence contract checks reject forbidden keys, secret-like values, raw responses, summary drift, and schema/checker drift."
        }
      ],
      "completion_check": "python3 scripts/check_alpha_product_truth.py --smoke-report <sanitized-live-report.json>",
      "remaining_action": "Watch future OpenAI Responses live smoke findings and convert any non-passing result into product truth."
    },
    {
      "id": "milestone8_live_smoke_anthropic_caching",
      "area": "milestone8",
      "requirement": "Run an API-key-gated Anthropic prompt-caching live smoke and keep only sanitized evidence.",
      "status": "satisfied",
      "required_for": ["milestone8", "public_beta", "v1"],
      "required_evidence": [
        "Sanitized live smoke JSON with scenario anthropic_prompt_caching and status passed.",
        "Product-truth register entries for any non-passing Anthropic caching findings."
      ],
      "current_evidence": [
        {
          "kind": "report",
          "path": "docs/internal/reports/2026-05-27-alpha-smoke-live-direct.md",
          "proves": "A sanitized live Anthropic prompt-caching smoke passed with raw responses omitted."
        },
        {
          "kind": "fixture",
          "path": "fixtures/source-files/alpha-smoke-live-direct-2026-05-27.json",
          "proves": "The reviewed smoke evidence includes scenario anthropic_prompt_caching with status passed."
        },
        {
          "kind": "report",
          "path": "docs/internal/reports/2026-05-26-alpha-smoke-live-no-credentials.md",
          "proves": "The live harness skips safely when ANTHROPIC_API_KEY is absent; it does not prove live provider behavior."
        },
        {
          "kind": "fixture",
          "path": "fixtures/anthropic-messages-raw-cache.json",
          "proves": "The extractor has fixture-backed cache-token coverage."
        },
        {
          "kind": "script",
          "path": "scripts/run_alpha_smoke.py",
          "proves": "The optional live Anthropic scenario runs through an aggregate smoke entrypoint that validates sanitized report shape before writing output."
        },
        {
          "kind": "script",
          "path": "scripts/run_alpha_smoke_preflight.py",
          "proves": "Credential readiness can be checked with sanitized next-action guidance and without emitting secret values."
        }
      ],
      "completion_check": "python3 scripts/check_alpha_product_truth.py --smoke-report <sanitized-live-report.json>",
      "remaining_action": "Watch future Anthropic live smoke findings and convert any non-passing result into product truth."
    },
    {
      "id": "milestone8_live_smoke_vercel_streaming",
      "area": "milestone8",
      "requirement": "Run a Vercel AI SDK streamText smoke beside a real SDK flow without making the SDK a core dependency.",
      "status": "satisfied",
      "required_for": ["milestone8", "public_beta", "v1"],
      "required_evidence": [
        "Sanitized framework smoke JSON with scenario vercel_ai_sdk_stream_text and status passed.",
        "Product-truth register entries for any non-passing Vercel streaming findings."
      ],
      "current_evidence": [
        {
          "kind": "report",
          "path": "docs/internal/reports/2026-05-27-live-framework-and-billing-review.md",
          "proves": "A sanitized Vercel AI SDK streamText live smoke passed against OpenAI with raw responses omitted."
        },
        {
          "kind": "fixture",
          "path": "fixtures/source-files/alpha-smoke-live-vercel-openai-2026-05-27.json",
          "proves": "The reviewed framework smoke evidence includes scenario vercel_ai_sdk_stream_text with status passed."
        },
        {
          "kind": "fixture",
          "path": "fixtures/source-files/alpha-smoke-live-all-2026-05-27.json",
          "proves": "The complete reviewed live smoke bundle includes Vercel AI SDK streamText with status passed."
        },
        {
          "kind": "report",
          "path": "docs/internal/reports/2026-05-27-operator-action-completion-audit.md",
          "proves": "The remaining Vercel live-smoke gap requires operator-provided OpenAI credentials and optional SDK dependencies."
        },
        {
          "kind": "script",
          "path": "scripts/run_vercel_alpha_smoke.mjs",
          "proves": "A dependency-optional Vercel sample/live smoke entrypoint exists and validates sanitized report shape before writing output."
        },
        {
          "kind": "fixture",
          "path": "fixtures/vercel-ai-sdk-stream-text-finish.json",
          "proves": "The streamText finish object shape is fixture-backed."
        },
        {
          "kind": "script",
          "path": "scripts/run_alpha_smoke_preflight.py",
          "proves": "Credential and optional Vercel SDK dependency readiness can be checked with sanitized next-action guidance and without emitting secret values."
        }
      ],
      "completion_check": "node scripts/run_vercel_alpha_smoke.mjs --mode live --output <sanitized-report.json> --allow-sample-prices",
      "remaining_action": "Watch future Vercel live smoke findings and convert any non-passing result into product truth."
    },
    {
      "id": "milestone8_live_smoke_langchain_agent",
      "area": "milestone8",
      "requirement": "Run a LangChain agent or callback smoke beside a real SDK/framework flow.",
      "status": "satisfied",
      "required_for": ["milestone8", "public_beta", "v1"],
      "required_evidence": [
        "Sanitized framework smoke JSON with scenario langchain_agent_run and status passed.",
        "Product-truth register entries for any non-passing LangChain findings."
      ],
      "current_evidence": [
        {
          "kind": "report",
          "path": "docs/internal/reports/2026-05-27-live-framework-and-billing-review.md",
          "proves": "A sanitized LangChain live smoke passed against OpenAI with raw responses omitted."
        },
        {
          "kind": "fixture",
          "path": "fixtures/source-files/alpha-smoke-live-langchain-openai-2026-05-27.json",
          "proves": "The reviewed framework smoke evidence includes scenario langchain_agent_run with status passed."
        },
        {
          "kind": "fixture",
          "path": "fixtures/source-files/alpha-smoke-live-all-2026-05-27.json",
          "proves": "The complete reviewed live smoke bundle includes LangChain with status passed."
        },
        {
          "kind": "report",
          "path": "docs/internal/reports/2026-05-27-operator-action-completion-audit.md",